product_id,cnt,min_price,max_price,product_category_name_english,title,image_url,ebay_item_id
a5bbc554f75cf4afa2cd56791015ec27,18,55.0,70.0,musical_instruments,Sennheiser E604 Dynamic Microphone,https://i.ebayimg.com/images/g/UBgAAOSweB1msQZi/s-l225.jpg,v1|375582464214|0
0efc91aa52d1f0669126d3000a94279b,24,84.99,109.99,bed_bath_table,No title,No image URL,No itemId
82c51c3938503a4ddc096fbed86428d6,24,99.0,99.0,construction_tools_safety,1pc Ear Plug Sleep Noise Cancel Soft Reusable Silicone Construction Tools Safety,https://i.ebayimg.com/images/g/Kk8AAOSwA~dlZQKC/s-l225.jpg,v1|335047254925|0
62d8daeee0db3a60c234c2d1bfd10651,48,24.9,30.9,bed_bath_table,No title,No image URL,No itemId
2423252b2432f1803e4f29e0974c6cf7,25,139.9,169.9,toys,Kids Toys Gifts for 4 5 6 7 8 9 10 11 12 + Year Old Boys Girls Cool Birthday,https://i.ebayimg.com/images/g/83YAAOSwkb5ltZWv/s-l225.jpg,v1|335230712388|0
fbd4031ddbc3d02b95834b62769d3ad0,24,120.0,138.0,housewares,Disney Baby Silicone Plate And Spoon Set Mickey,https://i.ebayimg.com/images/g/4OUAAOSwyqxmu37c/s-l225.jpg,v1|126624011949|0
2136c70bbe723d338fab53da3c03e6dc,89,29.0,29.0,watches_gifts,Analog Quartz Lightweight Handmade Wood Wrist Watch Mens Wooden Watches Gifts,https://i.ebayimg.com/images/g/Yo0AAOSwzldk66RD/s-l225.jpg,v1|404980451019|675029768071
ffc9caf33e2d1e9f44e3e06da19085f7,26,199.89,224.0,health_beauty,"Puffy Eye Serum, Professional Correction , 1.75 fl oz (52 ml)",https://i.ebayimg.com/images/g/blcAAOSwAh1mtk4V/s-l225.jpg,v1|134843110928|0
0521fe3eb04940304b489d0fb49a37dd,16,89.99,126.98,garden_tools,4pcs Garden Tools Set Trowel Rake Shovel Heavy Duty Metal Outdoor Ergonomic Kit,https://i.ebayimg.com/images/g/fQkAAOSwzf9hnp5l/s-l225.jpg,v1|154717994936|0
2b7aa376a6e728560bddb5558cc48e89,34,114.99,119.99,office_furniture,Reversible L Shape Laminate Office Furniture Desk 4 Color Options Available,https://i.ebayimg.com/images/g/M9cAAOSwFSxaTAYx/s-l225.jpg,v1|311413626861|0
59fe488ea6ac9439bc86663f4a564c23,21,16.99,17.0,telephony,Masters of the Universe Electronic Intercom Telephone System,https://i.ebayimg.com/images/g/fgwAAOSwqJNmu-WZ/s-l225.jpg,v1|186630670671|0
d9bdf643d95cb89844c0da1a0df1d16e,18,118.4,145.0,perfumery,The Crown Perfumery Crown Bouquet Eau De Parfum 1.7 Oz,https://i.ebayimg.com/images/g/hVoAAOSwnY9l3MfF/s-l225.jpg,v1|134953696495|0
952670bc019a73f0933157ec82ff6e4f,42,159.0,219.99,bed_bath_table,No title,No image URL,No itemId
ed77034b92386a1a8cfd3c648d715dde,16,14.99,19.5,telephony,THREE HANDSET ANSWERING SYSTEM,https://i.ebayimg.com/images/g/MDkAAOSwLUJmu4EO/s-l225.jpg,v1|176523112474|0
4b96786612ebe7463132fce2c4dca136,49,83.3,129.0,housewares,Housewares International Yellow Mini Covered Casseroles Baking Dish,https://i.ebayimg.com/images/g/-JkAAOSwnaNmu80l/s-l225.jpg,v1|315662357178|0
87283a98b24f9f1ac3a31b631073cf47,36,49.9,49.9,fashion_bags_accessories,purse accessories,https://i.ebayimg.com/images/g/-EcAAOSwwWpmLC2b/s-l225.jpg,v1|296558447922|0
5b3b5f9ae84ca9ead3138b199420cc94,34,129.9,139.0,toys,ROBLOX OG Toys Series 1-5 Toy Code ONLY *Sent FAST in Messages*,https://i.ebayimg.com/images/g/5OoAAOSwl-FmuUDH/s-l225.jpg,v1|285963143916|0
725cbfcaff95a4d43742fdf13cf43c75,19,39.9,49.9,cool_stuff,"Phoenix Cardinals  Mouse Pad  Vintage 1992  ""Cool Stuff""  USA New old stock",https://i.ebayimg.com/images/g/YxAAAOSwORFmgIlB/s-l225.jpg,v1|226251753717|0
e1da6ab77f4859eb17950e5df1c0f815,41,45.9,49.9,pet_shop,Littlest Pet Shop Lot lps Random 3pcs lps Figure with Random 7pcs Accessories,https://i.ebayimg.com/images/g/rUgAAOSwVFpkjRpp/s-l225.jpg,v1|166177206292|0
de480e3ae31eea2d2d97d694c43172fc,18,28.9,28.9,computers_accessories,"16 Inch MacBook Pro Sleeve, Waterproof Laptop Cover Case For Computers &amp",https://i.ebayimg.com/images/g/88MAAOSw4YZe4O2C/s-l225.jpg,v1|193509517700|0
ed2067a9c1f79553088a3c67b99a9f97,52,56.97,67.8,food,America’s Best Koi Food 20 lbs Koi Fish Food 5 mm Pellets 36% Premium Protein,https://i.ebayimg.com/images/g/9rAAAOSwO9FmZgHi/s-l225.jpg,v1|145901789794|0
f2399cabe080029634d12cec4f60dbf0,19,94.9,99.9,office_furniture,"L Shaped 50"" Home Office Furniture Desk with Drawers Gaming Desk with LED Lights",https://i.ebayimg.com/images/g/o8gAAOSwMGRmmjMm/s-l225.jpg,v1|365020427074|634635362994
94475071013412139f862c0bd7e3bb37,36,39.99,59.9,stationery,Design by Cool Korean Stationery Letter Set Camping & Swimming Envelopes Paper,https://i.ebayimg.com/images/g/RL8AAOSwRl1mpYWg/s-l225.jpg,v1|256584940944|0
f71050e65776861c8c3ec7a2d2b0194c,16,71.0,85.99,housewares,"Signature Housewares Canister Jar 7.5"" Debby Segura Designs 2009 Sorrento Red B4",https://i.ebayimg.com/images/g/93QAAOSwrmpmu20i/s-l225.jpg,v1|387292560006|0
08a58dc963320d6073623382b9ceb920,37,119.0,129.0,computers_accessories,"CREATIV COMPANY Figure beads - Candy, Cake & Ice Cream, 200 pcs. (69608)",https://i.ebayimg.com/images/g/M30AAOSwF5tmuggW/s-l225.jpg,v1|404939131834|0
163e6400e6dadd0fe04775c5e9331fda,16,50.0,50.0,baby,"Huggies Natural Care Sensitive Baby Wipes, Unscented, 3 Pack, 168 Total, White",https://i.ebayimg.com/images/g/WicAAOSwZ~dmhmmM/s-l225.jpg,v1|387179479270|0
91846781ef75057e134949400768e272,24,129.9,149.9,sports_leisure,MALBON Golf Sports Leisure Medium Length Skirt Breathable slim-fit V-neck Dress,https://i.ebayimg.com/images/g/jswAAOSw-s5mKR3j/s-l225.jpg,v1|375443478416|644391138127
cadb69af336c16aba5c5223599821245,26,13.65,13.65,electronics,Microsoft Xbox Series S 512GB HDMI PORT Issue,https://i.ebayimg.com/images/g/RZoAAOSwtvpmu8fb/s-l225.jpg,v1|305727062045|0
acc444eb5ad26f79d5a11baa6a03c439,27,120.0,140.0,furniture_decor,"Crafting with Wood Pallets: Projects for Rustic Furniture, Decor, Art, Gifts and",https://i.ebayimg.com/images/g/PlsAAOSwmfBf~bEQ/s-l225.jpg,v1|395435701293|0
380b4664ba5bb18cc9db78ee6bac3558,35,29.0,37.0,watches_gifts,Blood Pressure Watches Gifts for Him Smart Watch for Men Receive/Dial Call Wa...,https://i.ebayimg.com/images/g/xBQAAOSwlupltLdS/s-l225.jpg,v1|375217343848|0
ba4a91633739ceceb2b73b627e2cfbc3,22,136.97,149.99,office_furniture,Dollhouse Victorian Office Furniture 14pc Lot Desk Chair Globe Dictionary Vtg,https://i.ebayimg.com/images/g/K8QAAOSw7PFmgm~g/s-l225.jpg,v1|326218413854|0
186fe07c8b8005ec6a498587ffbc1352,36,29.0,29.0,watches_gifts,Romantic His and Hers Quartz Analog Wrist Watches Gifts Set for Lovers Set of 2,https://i.ebayimg.com/images/g/rEoAAOSwzqtg9qE2/s-l225.jpg,v1|265999229333|0
84a87daa85c8b432d90bc1baa0cb4388,17,59.9,89.9,baby,Flonase Allergy Relief Nasal Spray 2x144 Sprays Twin Pack 9/24,https://i.ebayimg.com/images/g/PscAAOSwIZ1msnO4/s-l225.jpg,v1|135182219614|0
5d66715cc928aadd0074f61332698593,64,18.9,19.9,electronics,BLACK Sony PSP 1000 System w/ Charger & 64gb Memory Card Bundle TESTED Import,https://i.ebayimg.com/images/g/9bYAAOSwQyJk~Q3V/s-l225.jpg,v1|194341832123|0
779dd392d4fbe5ca656bf3ceabecbf0b,16,115.0,157.0,construction_tools_construction,Smoothing Stretch Fillet Welding Line Construction Tools Construction Tools,https://i.ebayimg.com/images/g/Q6UAAOSwW-Bmp6CB/s-l225.jpg,v1|176481769375|476062500776
115e606ac8059e4cfa1c6c3310fb365c,22,39.9,39.9,computers_accessories,US Layout Keyboard Replacement Computers Accessories for 01AX160 01AX200,https://i.ebayimg.com/images/g/2rIAAOSwJR9mGbgK/s-l225.jpg,v1|116143622903|0
ba80c9f47a84d1e08465f72e22930c83,24,112.99,120.0,pet_shop,Littlest Pet Shop LPS Shorthair Cat 2pcs 339 468 Cute Toy for Girl Gift Animal,https://i.ebayimg.com/images/g/0tUAAOSwb6tmaWHE/s-l225.jpg,v1|166670556661|0
f7f59e6186e10983a061ac7bdb3494d6,39,34.9,34.9,housewares,"Signature Housewares Canister Jar 8.5"" Debby Segura Designs 2009 Sorrento Red G3",https://i.ebayimg.com/images/g/-tQAAOSwe~Jmu36n/s-l225.jpg,v1|387292672600|0
c20a3f598c16d77249da67e81caa8317,41,32.0,48.0,housewares,Housewares International Oval Fluted Baking Dish Yellow White SM 6/1/4”X 3 3/8”,https://i.ebayimg.com/images/g/p6EAAOSwyJZmu2jJ/s-l225.jpg,v1|235695315231|0
f4a38926843e01497a3f63a5d5740c72,20,13.62,13.65,electronics,Sony PlayStation PSP 1000/2000/3000 Console with Charger/New Battery Region Free,https://i.ebayimg.com/images/g/KD0AAOSwfaxkP174/s-l225.jpg,v1|204309390922|504861192410
9ecadb84c81da840dbf3564378b586e9,103,32.99,38.4,furniture_decor,"Re-design Prima Sunflower Fields Furniture Decor Transfer 22"" x 30""",https://i.ebayimg.com/images/g/BDQAAOSwZ6tfTEEy/s-l225.jpg,v1|203093308510|0
060cb19345d90064d1015407193c233d,26,140.5,147.9,auto,2024 Panini CAITLIN CLARK Collection One (1) Sealed Pack Possible Auto,https://i.ebayimg.com/images/g/6HUAAOSwVlxmrNyw/s-l225.jpg,v1|285989552065|0
4cc8bfa581f41841ce5e24aba773a44a,33,56.99,80.0,bed_bath_table,No title,No image URL,No itemId
3516632e8f52b679ff83d1665ecc990e,19,71.0,75.9,computers_accessories,Gigaware Male-to-Male Serial Coupler - Computers & Accessories- New 26-1410,https://i.ebayimg.com/images/g/tDgAAOSwmopeTyxl/s-l225.jpg,v1|143537832084|0
1a080577618e7fe4d9ddd8fb2b47a964,32,499.99,690.0,watches_gifts,3 Tier Scratch Resistant Durable Wooden Watch Holder Stand Holds 6 Watches Gifts,https://i.ebayimg.com/images/g/Y5wAAOSwX1NmdSUJ/s-l225.jpg,v1|126539892554|0
7f457254a89d62960399e075711b3deb,17,24.99,24.99,auto,"2024 Topps Chrome US Olympic Hopefuls Auto, Parallels & Base - Free Shipping",https://i.ebayimg.com/images/g/TQUAAOSwfvVmur-K/s-l225.jpg,v1|335528565161|545007950220
11fd9d7ba552e1d28872e008acf1e050,49,99.0,139.9,cool_stuff,Beer Coaster Collection Cool Stuff,https://i.ebayimg.com/images/g/7m4AAOSw1ORlPDhv/s-l225.jpg,v1|155854460884|0
216bb0e0cd43ffd832e0973d35e0377e,37,45.0,46.0,construction_tools_lights,No title,No image URL,No itemId
f7e5d0186f539b61586d7ddd247d2996,17,12.99,12.99,furniture_decor,Wood Carved Onlay Carpenter Decal Working Table Leg Applique Furniture Decor,https://i.ebayimg.com/images/g/VsAAAOSwAA1mBDTC/s-l225.jpg,v1|335323488481|544673212904
bb7181410b4e02f93f3697f765db53c7,22,109.99,135.0,baby,Johnsons Baby Powder Original with TALC 100 G / 3.53 oz Factory Sealed Lot Of 3,https://i.ebayimg.com/images/g/N8EAAOSw1JFmjIM-/s-l225.jpg,v1|266896904719|0
6cdd53843498f92890544667809f1595,155,299.0,364.0,health_beauty,"DHEA, 100 mg, 60 Vegetarian Capsules",https://i.ebayimg.com/images/g/uDIAAOSww1RmsrdI/s-l225.jpg,v1|134843066780|0
b84520a57891e7a8ae2c68741dcc7146,24,45.0,45.0,watches_gifts,Vintage Pocket Watches with Chain for Men Steam Train Pendant Fob Watches Gifts,https://i.ebayimg.com/images/g/cNkAAOSwTVxiVZPw/s-l225.jpg,v1|203911440218|0
642a40d4d73b4b2604968937de13634a,24,12.9,12.9,bed_bath_table,No title,No image URL,No itemId
28a652ff04e43c1bc57937a9f8770f9b,23,95.0,139.0,stationery,Vintage Stationary Alice V. Scott Illustrated Paper Envelopes 1970s Rare Trees,https://i.ebayimg.com/images/g/~00AAOSw1SNmt-IO/s-l225.jpg,v1|355943821778|0
583f158587cdecda3e8bdea694021e39,44,45.0,60.0,sports_leisure,Women Size 46 (fits BCD) black sports leisure no wire bra by Bestform # 6092x,https://i.ebayimg.com/images/g/grsAAOSwJEBmtXLL/s-l225.jpg,v1|256439504759|0
c45f017c36f9112a8bb4f170edfb1870,16,84.9,106.9,luggage_accessories,Magnetic Flower Hat Clip Travel Hat Bag Clips Hat Holder For Luggage Accessories,https://i.ebayimg.com/images/g/jWAAAOSwnVxmg1q0/s-l225.jpg,v1|395507491828|664229989228
acde6bd0b5f91190e2a123df389b0b47,17,24.9,36.9,auto,BOBBY WITT JR. 2020 1ST BOWMAN CHROME RC ROYALS AUTO 10 BECKETT 210510,https://i.ebayimg.com/images/g/jWcAAOSwhlVmq7UQ/s-l225.jpg,v1|235677964234|0
1600dcf1cea8c0c83702e07b577ab231,38,34.0,44.0,watches_gifts,Steampunk Men's Pocket Watches Cowboy Case with Necklace Chain Fob Watches Gifts,https://i.ebayimg.com/images/g/foEAAOSw1y9i7TfS/s-l225.jpg,v1|134191576298|0
c73628b1c3144b2e0c9c88072f21a213,29,99.0,139.0,auto,Jackson Merrill 2021 Bowman Chrome AUTO PSA SIGNED PADRES ROOKIE #119,https://i.ebayimg.com/images/g/Hb4AAOSwftFkObfL/s-l225.jpg,v1|204850241687|0
29427de7f8a9ee983d9dbc51cec569b4,96,82.99,99.99,cool_stuff,How to Draw Cool Stuff: The 5 Minute Workbook,https://i.ebayimg.com/images/g/fWoAAOSwrY1moRj8/s-l225.jpg,v1|326210045611|0
7fb04722aba7a2b632bac8f9819796f3,87,69.0,99.0,health_beauty,"Healthy Skin, Anti-Aging Perfector, SPF 20,  Fair to Light 20, 1 fl oz Exp 12/25",https://i.ebayimg.com/images/g/ivcAAOSwZZlmnZRD/s-l225.jpg,v1|335496519193|0
aa8d88eb4b9cb38894e33fa624c4287f,33,54.0,55.0,watches_gifts,Oulm 9315 Classic Casual Wristwatch Cool Black Three Time Zone Men Watches Gifts,https://i.ebayimg.com/images/g/P~cAAOSwGaJhDGEY/s-l225.jpg,v1|133840403752|0
668e8ee8f69c3545109fc40f72336e8f,16,79.9,109.9,sports_leisure,Walt Disney Sports & Leisure Cross Stitch Booklet by Craftways for Paragon - New,https://i.ebayimg.com/images/g/U3kAAOSwxBBmcIuu/s-l225.jpg,v1|235612479193|0
64fb265487de2238627ce43fe8a67efc,74,79.9,99.9,bed_bath_table,No title,No image URL,No itemId
c3097e07a0a5de0d4b4c836d90c5a284,30,13.69,13.7,electronics,"ANBERNIC RG35XXSP Handheld Game Console 3.5"" IPS Screen Retro Game Console Gifts",https://i.ebayimg.com/images/g/ZGAAAOSwNPlmmeh6/s-l225.jpg,v1|315568907675|614018580379
3ba2b0de14984ce8f072c58be8d701dd,19,99.9,104.99,toys,"My Mini Baby Accessories Zuru 5 Surprise *YOU PICK* Doll, Stroller, Crib,Blanket",https://i.ebayimg.com/images/g/GTMAAOSwX9Jmq9Yz/s-l225.jpg,v1|256589783228|556842332442
461f43be3bdf8844e65b62d9ac2c7a5a,143,115.0,227.0,watches_gifts,Men’s Military Leather Date Quartz Analog Army Casual Dress Wrist Watches Gifts,https://i.ebayimg.com/images/g/a68AAOSwi-tmLz1L/s-l225.jpg,v1|335427975091|544832635994
c72edc98e7d77f0c4c04ec80730c05f5,26,65.0,79.0,sports_leisure,Transportation-Sports-Leisure-Bicycle-Mountain Bike Maintenance & Repair-Manual!,https://i.ebayimg.com/images/g/ocgAAOSwpRlmii~g/s-l225.jpg,v1|235642474144|0
e1e932dfb67414e80b87ad97688cf2a3,23,99.0,105.0,toys,"YOU PICK! Disney Doorables Series 11, 12, Neon, Nightmare Before FLAT SHIPPING!",https://i.ebayimg.com/images/g/cvQAAOSwPKhmpua8/s-l225.jpg,v1|156306321726|457347106372
e19ddcc85537b41f22116c8d5425ef46,19,29.99,29.99,furniture_decor,"Black Agate Round Coffee Table, Kitchen Counter Desk Living Room Furniture Decor",https://i.ebayimg.com/images/g/dIwAAOSwrfVkmYIS/s-l225.jpg,v1|115844077966|415934485117
9fc0c73ce4d0eaaead44e81eeefebeb0,19,68.0,68.0,sports_leisure,Men's Sports Leisure Muscle Fitness Mesh Breathable Solid Sleeveless Tank Top,https://i.ebayimg.com/images/g/HOQAAOSw2IVl4Em6/s-l225.jpg,v1|375465140206|644406432083
63de2743d05ab59d85caa49e49459ac1,44,15.75,19.9,health_beauty,Fresh Sugar Face Polish Exfoliator  1oz/30g New With Box,https://i.ebayimg.com/images/g/x0EAAOSwdytfFw-6/s-l225.jpg,v1|373122380247|0
9c7ce59c96e74dfdfc51f13a4a6c3869,19,29.0,29.0,watches_gifts,Gerber’s Jewelry Watches Gifts Matchbook Providence Rhode Island,https://i.ebayimg.com/images/g/7D0AAOSwvXNmCfjG/s-l225.jpg,v1|186370989769|0
19421075ae0b585f2dc13ff149e2119d,59,45.9,49.9,sports_leisure,MOTORCYCLE SPORTS & LEISURE MAGAZINE | JUN 2022 | TRIUMPH TIGER 1200,https://i.ebayimg.com/images/g/NksAAOSw6LxjKins/s-l225.jpg,v1|144727203437|0
ee0c1cf2fbeae95205b4aa506f1469f0,89,44.99,53.99,perfumery,AMBER MOON Perfume Oil - Inspired by *Ambre Essense by Ambre Blends®,https://i.ebayimg.com/images/g/fDsAAOSw3zpmJJUa/s-l225.jpg,v1|335268920804|544586185293
5b8423dc7f23089c9c59c5d140eb5a1c,22,129.79,139.99,toys,"World's Smallest Toys.  Open  Box You Pick ,",https://i.ebayimg.com/images/g/t8MAAOSwsj1jxl7k/s-l225.jpg,v1|204226602965|504801427307
11bbef4e2a44601d9dd471aa1fb433e6,19,299.99,339.99,health_beauty,"Real Food, Beef Gelatin Powder, 1 lb (454 g)",https://i.ebayimg.com/images/g/uGIAAOSw-jNhUMX5/s-l225.jpg,v1|134843073592|0
542b3d80712d51eefe3a3cd1c5f4e8fe,25,35.9,42.9,cool_stuff,Phineas & Ferb: Quest for Cool Stuff (Complete),https://i.ebayimg.com/images/g/hCIAAOSwOh5mjOes/s-l225.jpg,v1|135139611925|0
6c3effec7c8ddba466d4f03f982c7aa3,95,19.9,34.2,consoles_games,Gaming consoles & Games,https://i.ebayimg.com/images/g/i2YAAOSwjBVmIwfZ/s-l225.jpg,v1|335357236540|0
51f876eb62be778c757503cf7f8a3b74,32,9.8,12.0,health_beauty,"Cayenne, 500 mg, 100 Veg Capsules",https://i.ebayimg.com/images/g/sZsAAOSwQeVmMSZd/s-l225.jpg,v1|135040109082|0
e94df75b2e9a8b056be0c144a731f55c,28,74.5,94.9,pet_shop,Mini Shop Pet LPS Tan Dachshund 909 with Accessories Who Love LPS Kids Gift Rare,https://i.ebayimg.com/images/g/WuQAAOSwL7NmmHtq/s-l225.jpg,v1|315576480686|0
98d61056e0568ba048e5d78038790e77,40,160.55,169.0,auto,2024 Museum Collection Fernando Tatis Jr. Base Auto Relic Red 1/5 ,https://i.ebayimg.com/images/g/dqIAAOSwd8Nmu~Kd/s-l225.jpg,v1|387293564311|0
dc404a1496a08f9f5540c8b5d4b92925,39,297.9,349.99,toys,All clean items for jailbreak | Roblox | Jailbreak | Cheap and Fast Delivery,https://i.ebayimg.com/images/g/w6kAAOSwNyBmP-AB/s-l225.jpg,v1|166757435036|466411018908
10717ff440b2320081989126e858b220,36,138.0,165.0,bed_bath_table,No title,No image URL,No itemId
e9def91e99c8ecb7c5cef5e31506a056,45,59.99,119.9,toys,POP MART LABUBU The Monsters Etciting Macaron Plush Doll Figure Toy Blind BOX US,https://i.ebayimg.com/images/g/K3IAAOSw8Nhmtxa~/s-l225.jpg,v1|375585311676|644509473829
d678178aa4291cd25a755a90188375c8,24,32.99,38.4,furniture_decor,"Vintage Solid Brass Ornate Furniture Decor Ornament Gold 4""",https://i.ebayimg.com/images/g/zqYAAOSwX1pfjbtf/s-l225.jpg,v1|333759570495|0
25e2023ed83352bde98dc1490d14c3d8,33,99.0,119.99,toys,AM TOYS | ADOPT FROM CHOW,https://i.ebayimg.com/images/g/fqoAAOSwq1dlBKi8/s-l225.jpg,v1|286003385975|588088559494
f177b434709ecb652dbee4f4b19aef2f,23,24.99,29.99,fashion_bags_accessories,Barbie Blonde Fashionista Doll Shoes Fashion Bags Accessories Closet NEW Mattel,https://i.ebayimg.com/images/g/Ar4AAOSwPrdb6j6x/s-l225.jpg,v1|383321909568|0
704ef63ad0ac345842ea734060a83db2,44,74.9,84.9,bed_bath_table,No title,No image URL,No itemId
7e0dc102074f8285580c9777f79c90cf,72,34.9,39.9,garden_tools,"Garden Tool Set, Stainless Steel Heavy Duty Gardening Tool Set, with Storage Bag",https://i.ebayimg.com/images/g/xPAAAOSw2MRmtxjM/s-l225.jpg,v1|387282295886|0
014a8a503291921f7b004a5215bb3c36,18,35.99,36.9,baby,Baby Newborn Diapers 44ct Free Shipping,https://i.ebayimg.com/images/g/K1kAAOSwxlxmr6a8/s-l225.jpg,v1|176507032708|0
be0dbdc3d67d55727a65d4cd696ca73c,27,64.99,79.9,computers_accessories,Suunto Dive 2 Zulu Strap Stealth Black Size L - Dive Computers Accessories,https://i.ebayimg.com/images/g/boUAAOSwLKplwtVt/s-l225.jpg,v1|375294731317|0
e67307ff0f15ade43fcb6e670be7a74c,40,18.17,18.99,health_beauty,"Dark Circle Serum, Fragrance Free, 1.75 fl oz (52 ml)",https://i.ebayimg.com/images/g/KaoAAOSwyCJi1t7Z/s-l225.jpg,v1|134843110592|0
fbce4c4cb307679d89a3bf3d3bb353b9,60,129.0,149.0,bed_bath_table,No title,No image URL,No itemId
dbb67791e405873b259e4656bf971246,89,61.4,88.0,computers_accessories,Suunto Dive 2 Textile Zulu Strap Black Size L; Dive Computers - Accessories,https://i.ebayimg.com/images/g/zGQAAOSwmGVmPBVU/s-l225.jpg,v1|256510073733|0
e44f675b60b3a3a2453ec36421e06f0f,83,102.9,107.0,sports_leisure,NWT Sports Leisure Bra Size Large Sage Celery Green Kyoyo Inserts,https://i.ebayimg.com/images/g/jcgAAOSw9T5lAJKm/s-l225.jpg,v1|155768700343|0
595fac2a385ac33a80bd5114aec74eb8,106,109.9,142.5,perfumery,"Oil Perfumery Baccarat Rouge 540 Perfume Oil, 10 mL/ 0.34 fl oz. NEW",https://i.ebayimg.com/images/g/H4sAAOSw3uJmhtK5/s-l225.jpg,v1|375581163108|0
a92930c327948861c015c919a0bcb4a8,156,77.0,78.0,watches_gifts,Children Cartoon Watch Student Boys Girls Wristwatch Kids Dinosaur Watches Gifts,https://i.ebayimg.com/images/g/CWwAAOSw8JZbm40i/s-l225.jpg,v1|323446279482|512505830037
86133a2151bd98a3ed2ad758709e6d1b,16,54.9,59.9,cool_stuff,Phineas and Ferb: Quest for Cool Stuff (Nintendo Wii) Missing Manual - Tested,https://i.ebayimg.com/images/g/uowAAOSwS4FmsqBZ/s-l225.jpg,v1|375577890740|0
574597aaf385996112490308e37399ce,24,49.0,49.0,housewares,Disney Parks Mickey Mouse  Silicone Muffin Mold - BRAND NEW,https://i.ebayimg.com/images/g/IVQAAOSwQKRmu6ve/s-l225.jpg,v1|305726937011|0
66a0a6e02b7f543e5b021ce361f267d4,32,119.99,139.99,cool_stuff,"Hot Rods toys assorted Makes And Models, Adult Owned, Make Offers! Cool Stuff 😎",https://i.ebayimg.com/images/g/RRwAAOSwU4lmr9Pv/s-l225.jpg,v1|315631230976|0
86c43103446290e7efacad3701cd654d,28,35.0,35.0,watches_gifts,Ladies Wrist Watches Quartz Analogue Womens Steel Leather Casual Watches Gifts,https://i.ebayimg.com/images/g/-HEAAOSw~ahhNr9q/s-l225.jpg,v1|375565227320|644490784604
c2ece64199af7a53793ed9612a89a8cd,35,75.0,88.34,furniture_decor,"Distressed Borders - Redesign with Prima Furniture Decor Transfer 24"" x 35""",https://i.ebayimg.com/images/g/Wo0AAOSwpmJgoBzB/s-l225.jpg,v1|194131692534|0
89b190a046022486c635022524a974a8,20,65.49,65.49,furniture_decor,Antique? English? Cloverleaf Side Table Furniture Decor Regency Rare,https://i.ebayimg.com/images/g/7HIAAOSwQdRmC1Mn/s-l225.jpg,v1|266748414135|0
a869ec6209c361ca46dad85a5530e119,17,135.0,169.9,sports_leisure,MOTORCYCLE SPORTS & LEISURE MAGAZINE | NOV 2021 | BMW R18 B,https://i.ebayimg.com/images/g/IukAAOSwKO9jG6iz/s-l225.jpg,v1|325337641434|0
2fea0f2cec6b6324a277d4a61c2ed2c6,58,35.0,95.0,health_beauty,"Collagen + Rosewater,  Plump + Glow Facial Mist, 8 fl oz (237 ml)",https://i.ebayimg.com/images/g/MvkAAOSwVDti1t7e/s-l225.jpg,v1|134843110777|0
e7f85e7f0203b7b95cc1b4c21b4b070c,23,259.99,269.0,cool_stuff,"How to Draw Cool Stuff: Shading, Textures and Optical Illusions - GOOD",https://i.ebayimg.com/images/g/rOIAAOSwddNhEU1o/s-l225.jpg,v1|274415423103|0
4cac1a12a6fe9ffba4a9556dbe582e28,29,25.99,27.99,auto,2020-21 Anthony Edwards Auto Chase..40 packages see description!,https://i.ebayimg.com/images/g/YIkAAOSwQ-JmTQ7f/s-l225.jpg,v1|186453402802|0
13db47eae724e2848e12b71a617a3a41,26,467.0,579.0,audio,Wireless Bluetooth 3.5mm AUX Audio Stereo Music Home Car Receiver Adapter New,https://i.ebayimg.com/images/g/OA8AAOSwwmBdwfZy/s-l225.jpg,v1|143433293697|0
f71973c922ccaab05514a36a8bc741b8,65,89.9,129.9,luggage_accessories,Silicone Suitcase Wheels Protection Cover Travel Luggage Accessories 18 Pc Purpl,https://i.ebayimg.com/images/g/LJwAAOSwXvFmb64-/s-l225.jpg,v1|166827778279|0
af0a99476d96dcc1a1baa7c0d9ff6b9d,22,499.9,649.65,health_beauty,"Biotin, Leave-In Treatment, 8 fl oz (237 ml)",https://i.ebayimg.com/images/g/y0kAAOSw8GZlcSeP/s-l225.jpg,v1|134843115051|0
35557c68a22ecebcf066e25ca2ddc144,16,16.9,16.9,garden_tools,9-Piece Garden Tools Set with Gloves and Colorful Tote  Gardening Hand Tools Kit,https://i.ebayimg.com/images/g/pJAAAOSwsnhfLR0u/s-l225.jpg,v1|233672988370|0
2481a472d98c582b46bc2dfeae6f539f,22,59.55,59.9,furniture_decor,Modern LED High Gloss S-shaped Coffee Table Sofa Side End Table Furniture Decor,https://i.ebayimg.com/images/g/R9oAAOSwF4dhiN-k/s-l225.jpg,v1|315479920164|0
71540d636652fc682032d3b3c0a180c1,20,113.85,119.85,home_construction,"Vintage Alladin Homes, catalogue , new home construction, 1918",https://i.ebayimg.com/images/g/6b8AAOSwv1tmgZAP/s-l225.jpg,v1|176449278582|0
82a61259a621866c4ba63743da29a342,16,119.8,129.9,sports_leisure,HOGAN Thick Soled Biscuit Shoes Leather Breathable Sports Leisure Shoes Unisex,https://i.ebayimg.com/images/g/0I4AAOSwbqVmtPoC/s-l225.jpg,v1|395583826427|664332457063
31a89a7044c5b133cf646404a4e86022,18,150.0,150.0,housewares,"Vintage Twin Size Disney Beauty And The Beast 3pc Sheet Set Flat, Fitted, Pillow",https://i.ebayimg.com/images/g/w8wAAOSwJalmu8Fy/s-l225.jpg,v1|135192061757|0
0cf41187284d7f099adc8415a743ebbd,35,35.9,35.9,baby,Oso & Me Baby Organic Everyday Clothing Set Pink,https://i.ebayimg.com/images/g/W6gAAOSw13tllutB/s-l225.jpg,v1|335269531029|0
c9c6fde711572c1ad99ca12728c6af00,77,29.99,59.99,telephony,Fully Restored & Working Western Electric 202 Telephone and 534 or 634 Subset,https://i.ebayimg.com/images/g/iA8AAOSwjcllJFou/s-l225.jpg,v1|145355360501|0
e53e557d5a159f5aa2c5e995dfdf244b,185,74.9,109.9,computers_accessories,Suunto 24mm Dive 1 Silicone Coral Strap - Dive Computers Accessories,https://i.ebayimg.com/images/g/uV8AAOSwnmxfika5/s-l225.jpg,v1|373279066614|0
99f5b2240b82bf9387e5cf2fc0335b08,23,91.9,159.9,computers_accessories,Suunto D4I Novo Extension Strap White - Dive Computers Accessories (SS020449000),https://i.ebayimg.com/images/g/Hl4AAOSwdmZlKWct/s-l225.jpg,v1|375014595528|0
698b3ddae2f0b80c2a48fb40624ca4e4,21,199.0,295.0,furniture_decor,"Crafting with Wood Pallets: Projects for Rustic Furniture, Decor, Art, Gifts and",https://i.ebayimg.com/images/g/mooAAOSwWxNYwpnK/s-l225.jpg,v1|335509680328|0
3fc18e3aefe7b9346bd15de863fa0365,17,69.0,86.0,housewares,Aroma Housewares 60-Cup Cooked Commercial Rice Cooker - White (ARC-1033E),https://i.ebayimg.com/images/g/VU4AAOSw2GJmtvAd/s-l225.jpg,v1|145942361242|0
cd48f265a63e13b762601f5f794c5fca,93,43.0,79.49,drinks,"BHIP BLUE Blend Energy Drink Promote Health, Fitness Weight loss ENVIO GRATIS",https://i.ebayimg.com/images/g/jYwAAOSwa2xjUvEI/s-l225.jpg,v1|234745330826|0
764292b2b0f73f77a0272be03fdd45f3,58,79.9,99.9,furniture_decor,Unpainted Wood Carved Corner Decal-Onlay Applique-Frame Furniture Decor 4pcs,https://i.ebayimg.com/images/g/rdcAAOSwD19lI4v6/s-l225.jpg,v1|364092101287|0
c92f0e7b9d49a9543558d6532772441b,34,129.9,149.9,luggage_accessories,Silicone Suitcase Wheels Protection Cover Travel Luggage Accessories 8 Pc Black,https://i.ebayimg.com/images/g/u5MAAOSw981mb7K-/s-l225.jpg,v1|166827803161|0
84f456958365164420cfc80fbe4c7fab,107,84.9,99.0,bed_bath_table,No title,No image URL,No itemId
c403e106353e1aa40efe783ecb39ed7a,32,34.9,38.9,bed_bath_table,No title,No image URL,No itemId
b0961721fd839e9982420e807758a2a6,126,49.0,59.9,garden_tools,Lawn Mower Blade Balancer Sharpener Set For Lawn Mower Tractor Garden Tools,https://i.ebayimg.com/images/g/yxEAAOSwtOhl8qWY/s-l225.jpg,v1|133491330200|0
cf857bce01d442bb8631a548a4432def,20,119.9,179.99,baby,Carter's Baby Girls' 3-Piece Heart Little Character Set   9M,https://i.ebayimg.com/images/g/2noAAOSwBmtl4e8J/s-l225.jpg,v1|404832562517|674855524302
e03102efbc2229024c89be731f0aedcb,53,34.9,39.9,stationery,Kawaii Loose Mini Memo Sheets 10pc Sample Lot & Kawaii Surprise!,https://i.ebayimg.com/images/g/llkAAOSwktpelciz/s-l225.jpg,v1|221532751429|0
